{
  "$schema": "http://json-schema.org/draft-04/schema#",
  "type": "object",
  "properties": {
    "template": {
      "type": "array",
      "items": [
        {
          "type": "string"
        },
        {
          "type": "string"
        },
        {
          "type": "string"
        },
        {
          "type": "string"
        },
        {
          "type": "string"
        },
        {
          "type": "string"
        },
        {
          "type": "string"
        },
        {
          "type": "string"
        }
      ]
    },
    "genre": {
      "type": "array",
      "items": [
        {
          "type": "string"
        },
        {
          "type": "string"
        }
      ]
    },
    "genre_modifier": {
      "type": "array",
      "items": [
        {
          "type": "string"
        },
        {
          "type": "string"
        }
      ]
    },
    "perspective": {
      "type": "array",
      "items": [
        {
          "type": "string"
        },
        {
          "type": "string"
        }
      ]
    },
    "character": {
      "type": "object",
      "properties": {
        "nature": {
          "type": "array",
          "items": [
            {
              "type": "string"
            },
            {
              "type": "string"
            }
          ]
        },
        "description": {
          "type": "array",
          "items": [
            {
              "type": "string"
            },
            {
              "type": "string"
            }
          ]
        },
        "description_post": {
          "type": "array",
          "items": [
            {
              "type": "string"
            },
            {
              "type": "string"
            }
          ]
        }
      },
      "required": [
        "nature",
        "description",
        "description_post"
      ]
    },
    "goal": {
      "type": "array",
      "items": [
        {
          "type": "string"
        },
        {
          "type": "string"
        }
      ]
    },
    "settings": {
      "type": "object",
      "properties": {
        "place": {
          "type": "array",
          "items": [
            {
              "type": "string"
            },
            {
              "type": "string"
            },
            {
              "type": "string"
            },
            {
              "type": "string"
            }
          ]
        },
        "description": {
          "type": "array",
          "items": [
            {
              "type": "string"
            },
            {
              "type": "string"
            }
          ]
        }
      },
      "required": [
        "place",
        "description"
      ]
    },
    "theme": {
      "type": "array",
      "items": [
        {
          "type": "string"
        },
        {
          "type": "string"
        }
      ]
    },
    "mood": {
      "type": "array",
      "items": [
        {
          "type": "string"
        },
        {
          "type": "string"
        }
      ]
    },
    "wildcard": {
      "type": "array",
      "items": [
        {
          "type": "string"
        },
        {
          "type": "string"
        }
      ]
    }
  },
  "required": [
    "template",
    "genre",
    "genre_modifier",
    "perspective",
    "character",
    "goal",
    "settings",
    "theme",
    "mood",
    "wildcard"
  ]
}